[
  {
    "schema_version": "0.1.0",
    "id": "finding-001",
    "title": "Example finding title",
    "severity": "medium",
    "description": "Synthetic description for a sample finding.",
    "impact": "Synthetic impact statement.",
    "remediation": "Synthetic remediation guidance.",
    "evidence_refs": ["evidence-001"],
    "references": ["https://example.com"]
  }
]
